{
  "supplierId": "s16-d",
  "displayName": "Quartzstone Cup Factory Co., Ltd. (demo)",
  "country": "CN",
  "ids": {
    "uscc": "91330200F0E0Y4L56X"
  },
  "listing": {
    "url": "https://example.invalid/e3/set-16/s16-d",
    "sourceType": "mock",
    "rawTextRef": "data/suppliers/eval/set-16/raw/d.txt"
  },
  "offer": {
    "currency": "CNY",
    "fobUnit": {
      "value": "550",
      "sourceUrl": "https://example.invalid/e3/set-16/s16-d#price",
      "retrievedAt": "2026-10-18T00:00:00Z",
      "snippetHash": "0xb55f7a7804c670d8fcbad5e9f4f1112dc0328c94fbf70c0afcdace2c9d974c00",
      "evidence": "tier3",
      "sourceType": "mock"
    },
    "moq": 200,
    "leadTimeDays": 13,
    "freightPerUnit": "60",
    "incoterm": "FOB"
  },
  "terms": {
    "escrow": true,
    "offPlatformDiscount": false,
    "payeeType": "company"
  },
  "certificates": [
    {
      "type": "FDA 21 CFR food contact test report",
      "issuer": "Northgate Testing Lab (fictional)",
      "ref": "FDA-586548-1",
      "tier": "tier2"
    }
  ],
  "metrics": {
    "rating": 4.3,
    "responseRate": 0.74,
    "yearsOnPlatform": 7
  },
  "xenditTest": {
    "channel": "MOCK_ONLY",
    "accountNumber": "7792513381",
    "holderName": "Quartzstone Cup Factory Co., Ltd. (demo) - DEMO, DO NOT PAY"
  }
}
