{
  "supplierId": "s20-a",
  "displayName": "Valepoint Houseware Co., Ltd. (demo)",
  "country": "CN",
  "ids": {
    "uscc": "91350200CRGWMYRB9E"
  },
  "listing": {
    "url": "https://example.invalid/e3/set-20/s20-a",
    "sourceType": "mock",
    "rawTextRef": "data/suppliers/eval/set-20/raw/a.txt"
  },
  "offer": {
    "currency": "CNY",
    "fobUnit": {
      "value": "710",
      "sourceUrl": "https://example.invalid/e3/set-20/s20-a#price",
      "retrievedAt": "2026-10-18T00:00:00Z",
      "snippetHash": "0x44b17ce3c04c566ec7731fa5b322b33b8798fb500e42820d7a3114751617a114",
      "evidence": "tier3",
      "sourceType": "mock"
    },
    "moq": 500,
    "leadTimeDays": 35,
    "freightPerUnit": "100",
    "incoterm": "CIF"
  },
  "terms": {
    "escrow": true,
    "offPlatformDiscount": false,
    "payeeType": "company"
  },
  "certificates": [
    {
      "type": "FDA 21 CFR food contact test report",
      "issuer": "Riverbend Analysis Centre (fictional)",
      "ref": "FDA-379228-1",
      "tier": "tier2"
    },
    {
      "type": "GB 4806 food contact test report",
      "issuer": "Riverbend Analysis Centre (fictional)",
      "ref": "GB-774065-2",
      "tier": "tier1"
    }
  ],
  "metrics": {
    "rating": 4.5,
    "responseRate": 0.73,
    "yearsOnPlatform": 3
  },
  "xenditTest": {
    "channel": "MOCK_ONLY",
    "accountNumber": "7614722932",
    "holderName": "Valepoint Houseware Co., Ltd. (demo) - DEMO, DO NOT PAY"
  }
}
